{
  "actor_id": "ABS.ACTOR.EXAMPLE",
  "authority_ref": "ABS.AUTHORITY.EXAMPLE",
  "candidate_hash": "sha256:0000000000000000000000000000000000000000000000000000000000000000",
  "evidence_ids": [
    "ABS.EVIDENCE.EXAMPLE"
  ],
  "interface_id": "ABS.IFACE.PUBLICATION.DERIVE",
  "limitations": [
    "example limitations"
  ],
  "payload": {
    "detail": "example payload"
  },
  "request_id": "ABS.REQUEST.0001",
  "result_state": "PASS",
  "schema_version": "1.0.0",
  "scope_id": "ABS.SCOPE.EXAMPLE"
}
